discourse_boundary,discourse_part,discourse_text,adjudicated_discourse_type,adjudicated_effectiveness,adjudicated_hierarchical,adjudicated_parallel,jialiwang_discourse_type_boundary,jialiwang_effectiveness(f_27),jialiwang_hierarchical,jialiwang_parallel,mthomas145_discourse_type_boundary,mthomas145_effectiveness(f_27),mthomas145_hierarchical,mthomas145_parallel
"(0, 68)",s1p1,I believe people gain the most amount of success through cooperation.,"Final_Claim (0, 68)",3,-,-,"Final_Claim (0, 68)",3,-,-,"Final_Claim (0, 68)",3,-,-
"(70, 129)",s1p1,"In a work area, your coworkers are there to help you strive.","Data (70, 662)",2,"s1p1|Final_Claim|0,68","s1p3|Data|0,279; s1p4|Data|0,313; s1p5|Data|0,303","Data (70, 662)",1,"s1p1|Final_Claim|0,68","s1p3|Data|0,279; s1p4|Data|0,313; s1p5|Data|0,303","Primary_Claim (70, 129)",3,"s1p1|Final_Claim|0,68","s1p2|Primary_Claim|0,62"
"(131, 443)",s1p1,"However, if you are rude and always try to be ahead by putting others down, nobody will help you. Treat others the way you want to be treated. Once you get the title of someone as stuck-up, it will stay with you forever. When a time comes when you need a favor, those you stepped on will not be there to help you.","Data (70, 662)",2,"s1p1|Final_Claim|0,68","s1p3|Data|0,279; s1p4|Data|0,313; s1p5|Data|0,303","Data (70, 662)",1,"s1p1|Final_Claim|0,68","s1p3|Data|0,279; s1p4|Data|0,313; s1p5|Data|0,303","Data (131, 443)",2,"s1p1|Primary_Claim|70,129","s1p1|Data|445,662"
"(445, 662)",s1p1,"In camp when I was a counselor, we learned cooperation skills. We worked together, we strived together. We all had to be on the same page in order to deliver the same message and the participants would not be confused.","Data (70, 662)",2,"s1p1|Final_Claim|0,68","s1p3|Data|0,279; s1p4|Data|0,313; s1p5|Data|0,303","Data (70, 662)",1,"s1p1|Final_Claim|0,68","s1p3|Data|0,279; s1p4|Data|0,313; s1p5|Data|0,303","Data (445, 662)",3,"s1p1|Primary_Claim|70,129","s1p1|Data|131,443"
"(0, 62)",s1p2,"On the other hand, many teachers/companies promote competition.","Primary_Claim (0, 62)",1,"s1p1|Final_Claim|0,68",-,"Primary_Claim (0, 62)",1,"s1p1|Final_Claim|0,68",-,"Primary_Claim (0, 62)",2,"s1p1|Final_Claim|0,68","s1p1|Primary_Claim|70,129"
"(64, 464)",s1p2,"It is a way for them to encourage someone to do the best they can. For example, they might offer incentives such as promotion. Is promotion worth it if you had to go against your friends and go out of your way to make sure they do not succeed? This is where ethics and morality come in to play. People of good moral background want what is best not only for themselves, but also for those around them.","Data (64, 464)",1,"s1p2|Primary_Claim|0,62",-,"Data (64, 464)",1,"s1p2|Primary_Claim|0,62",-,"Data (64, 464)",3,"s1p2|Primary_Claim|0,62","s1p3|Data|0,279; s1p4|Data|0,313"
"(0, 279)",s1p3,"Imagine winning a trip on a cruise for beating everyone else in a race. It would make you happy, but it would make you even more happier if you worked with everyone in that race and won a group trip. You would not be alone and everyone would be able to join in on the celebration.","Data (0, 279)",2,"s1p1|Final_Claim|0,68","s1p1|Data|70,662; s1p4|Data|0,313; s1p5|Data|0,303","Data (0, 279)",2,"s1p1|Final_Claim|0,68","s1p1|Data|70,662; s1p4|Data|0,313; s1p5|Data|0,303","Data (0, 279)",3,"s1p2|Primary_Claim|0,62","s1p2|Data|64,464; s1p4|Data|0,313"
"(0, 313)",s1p4,"Competing is not a terrible idea, but if you are morally doing something wrong while competing, it is. It is better to share the success than to go through it alone. Nobody wants to die alone and that is why people get married and have a family. Not only to share success, but also to share the joy success brings.","Data (0, 313)",2,"s1p1|Final_Claim|0,68","s1p1|Data|70,662; s1p3|Data|0,279; s1p5|Data|0,303","Data (0, 313)",1,"s1p1|Final_Claim|0,68","s1p1|Data|70,662; s1p3|Data|0,279; s1p5|Data|0,303","Data (0, 313)",2,"s1p2|Primary_Claim|0,62","s1p2|Data|64,464; s1p3|Data|0,279"
"(0, 303)",s1p5,"Also, the more people you have on your side, the greater the chance of creating something better and more efficient. It is good to hear everyone's ideas and that would help people become more open-minded to new innovations. Without new ideas and innovations, we would all still be stuck with flip phones.","Data (0, 303)",2,"s1p1|Final_Claim|0,68","s1p1|Data|70,662; s1p3|Data|0,279; s1p4|Data|0,313","Data (0, 303)",2,"s1p1|Final_Claim|0,68","s1p1|Data|70,662; s1p3|Data|0,279; s1p4|Data|0,313","Concluding_Summary (0, 303)",3,"s1p1|Final_Claim|0,68",-
