discourse_boundary,discourse_part,discourse_text,adjudicated_discourse_type,adjudicated_effectiveness,adjudicated_hierarchical,adjudicated_parallel,jialiwang_discourse_type_boundary,jialiwang_effectiveness(f_27),jialiwang_hierarchical,jialiwang_parallel,mthomas145_discourse_type_boundary,mthomas145_effectiveness(f_27),mthomas145_hierarchical,mthomas145_parallel
"(0, 72)",s1p1,I believe that people achieve more by competition rather than cooperation,"Final_Claim (0, 156)",2,-,-,"Final_Claim (0, 156)",2,-,-,"Final_Claim (0, 72)",2,-,-
"(74, 156)",s1p1,"as in a competition, the driving force for an individual is to win the competition.","Final_Claim (0, 156)",2,-,-,"Final_Claim (0, 156)",2,-,-,"Data (74, 236)",3,"s1p1|Final_Claim|0,72","s1p1|Data|238,445"
"(158, 236)",s1p1,This allows an individual to think about new ideas which purely belongs to him.,"Data (158, 445)",2,"s1p1|Final_Claim|0,156","s1p2|Data|0,185","Data (158, 445)",1,"s1p1|Final_Claim|0,156","s1p2|Data|0,185","Data (74, 236)",3,"s1p1|Final_Claim|0,72","s1p1|Data|238,445"
"(238, 445)",s1p1,"Also, when person is in competition, he/she is not dependent on others and must work wholeheartedly. Whereas, when we are in cooperation, people are dependent on each other and tend to be lazy and learn less.","Data (158, 445)",2,"s1p1|Final_Claim|0,156","s1p2|Data|0,185","Data (158, 445)",1,"s1p1|Final_Claim|0,156","s1p2|Data|0,185","Data (238, 445)",3,"s1p1|Final_Claim|0,72","s1p1|Data|74,236"
"(0, 185)",s1p2,I also believe that self learning is the best learning in this world. When we learn things on our own then we remember them for rest of our lives and hence it helps in achieving success.,"Data (0, 185)",1,"s1p1|Final_Claim|0,156","s1p1|Data|158,445","Data (0, 185)",1,"s1p1|Final_Claim|0,156","s1p1|Data|158,445","Data (0, 185)",2,"s1p1|Final_Claim|0,72",-
