discourse_boundary,discourse_part,discourse_text,adjudicated_discourse_type,adjudicated_effectiveness,adjudicated_hierarchical,adjudicated_parallel,jialiwang_discourse_type_boundary,jialiwang_effectiveness(f_27),jialiwang_hierarchical,jialiwang_parallel,mthomas145_discourse_type_boundary,mthomas145_effectiveness(f_27),mthomas145_hierarchical,mthomas145_parallel
"(0, 193)",s1p1,"In the social media, people are like colorful packages in stores. They look nice and attractive, but when it comes to the reality, they look less attractive then they appearance on social media.","Data (0, 397)",2,"s1p1|Final_Claim|399,441","s1p1|Data|443,851","Data (0, 397)",2,"s1p1|Final_Claim|399,441","s1p1|Data|443,851","Final_Claim (0, 193)",2,-,-
"(195, 397)",s1p1,"For examples, some Celebrities appearance are more importance then their ability, I think it is because they are more attractive then normal people. People will take then to be their model to their life.","Data (0, 397)",2,"s1p1|Final_Claim|399,441","s1p1|Data|443,851","Data (0, 397)",2,"s1p1|Final_Claim|399,441","s1p1|Data|443,851","Data (195, 508)",2,"s1p1|Final_Claim|0,193","s1p1|Data|510,851"
"(399, 441)",s1p1,Impression are really importance on people.,"Final_Claim (399, 441)",2,-,-,"Final_Claim (399, 441)",2,-,-,"Data (195, 508)",2,"s1p1|Final_Claim|0,193","s1p1|Data|510,851"
"(443, 508)",s1p1,Because they won't take people with bad impression as their model.,"Data (443, 851)",2,"s1p1|Final_Claim|399,441","s1p1|Data|0,397","Data (443, 851)",2,"s1p1|Final_Claim|399,441","s1p1|Data|0,397","Data (195, 508)",2,"s1p1|Final_Claim|0,193","s1p1|Data|510,851"
"(510, 851)",s1p1,"There are a lot of examples for "" appearances are mistaken for reality"". Such as, advertisements. we see a lot of ads on TV, computers and out phones. The companies always says how good their products are. They makes people buy their products. But after their customers got their things, there is always people complaining about the products.","Data (443, 851)",2,"s1p1|Final_Claim|399,441","s1p1|Data|0,397","Data (443, 851)",2,"s1p1|Final_Claim|399,441","s1p1|Data|0,397","Data (510, 851)",2,"s1p1|Final_Claim|0,193","s1p1|Data|195,508"
