discourse_boundary,discourse_part,discourse_text,adjudicated_discourse_type,adjudicated_effectiveness,adjudicated_hierarchical,adjudicated_parallel,jialiwang_discourse_type_boundary,jialiwang_effectiveness(f_27),jialiwang_hierarchical,jialiwang_parallel,mthomas145_discourse_type_boundary,mthomas145_effectiveness(f_27),mthomas145_hierarchical,mthomas145_parallel
"(0, 339)",s1p1,"Cooperating is a much more difficult task than competing. Cooperating means finding compromises, being able to listen and to accept other people's opinion. I personally find it very difficult to work in a team, because I usually want to express my own ideas and to work ""my way"" without accepting compromises with the others' point of view.","Lead (0, 339)",-,-,-,"Nonannotated (0, 339)",-,-,-,"Nonannotated (0, 339)",-,-,-
"(0, 147)",s1p2,"In spite of this personal difficulty, I am convinced that ""you can go faster if you are alone, but you can go further if you are with someone else"".","Final_Claim (0, 147)",3,-,-,"Final_Claim (0, 147)",3,-,-,"Final_Claim (0, 147)",2,-,-
"(149, 612)",s1p2,"During high school I had the opportunity to study with my classmates many times before tests and exams. Sometimes they needed my help with a subject, and sometimes I needed their help with another. I realized how studying together is useful and effective particularly when it was them who needed my help. When they asked me questions, I was forced to think and to explain things clearly, and sometimes I also realized I did not know the answers to basic questions!","Data (149, 612)",2,"s1p2|Final_Claim|0,147",-,"Data (149, 612)",2,"s1p2|Final_Claim|0,147",-,"Data (149, 612)",3,"s1p2|Final_Claim|0,147","s1p3|Data|0,371"
"(0, 28)",s1p3,I usually have fun competing.,"Nonannotated (0, 28)",-,-,-,"Nonannotated (0, 28)",-,-,-,"Data (0, 371)",2,"s1p2|Final_Claim|0,147","s1p2|Data|149,612"
"(30, 73)",s1p3,"However, competition can drive people crazy.","Primary_Claim (30, 73)",-,"s1p2|Final_Claim|0,147",-,"Primary_Claim (30, 73)",-,"s1p2|Final_Claim|0,147",-,"Data (0, 371)",2,"s1p2|Final_Claim|0,147","s1p2|Data|149,612"
"(75, 371)",s1p3,"They may become too arrogant for their success or too depressed for their failures. When at high school I wanted to be the one with the highest mark and I did not succeed, I remember I was strongly disappointed, angry and sad. This feeling of failure because of someone else's success is terrible.","Data (75, 371)",2,"s1p3|Primary_Claim|30,73",-,"Data (75, 371)",2,"s1p3|Primary_Claim|30,73",-,"Data (0, 371)",2,"s1p2|Final_Claim|0,147","s1p2|Data|149,612"
"(0, 410)",s1p4,"Cooperation can free us from this constant race between each other and help us build stronger and more healthy relationships. Aristotle said that ""man is a social animal"". I am convinced this is true. Sometimes it is way easier to stay on our own and to walk our own path, but this solitude cannot last forever. If people are together, they can help each other and wait for one another is somebody falls behind.","Concluding_Summary (0, 410)",3,"s1p2|Final_Claim|0,147",-,"Concluding_Summary (0, 410)",3,"s1p2|Final_Claim|0,147",-,"Concluding_Summary (0, 410)",2,"s1p2|Final_Claim|0,147",-
