discourse_boundary,discourse_part,discourse_text,adjudicated_discourse_type,adjudicated_effectiveness,adjudicated_hierarchical,adjudicated_parallel,jialiwang_discourse_type_boundary,jialiwang_effectiveness(f_27),jialiwang_hierarchical,jialiwang_parallel,mthomas145_discourse_type_boundary,mthomas145_effectiveness(f_27),mthomas145_hierarchical,mthomas145_parallel
"(0, 79)",s1p1,"In my opinion, images and impressions does have too much of an effect on people.","Final_Claim (0, 79)",2,-,-,"Final_Claim (0, 79)",2,-,-,"Final_Claim (0, 79)",2,-,-
"(81, 226)",s1p1,"First of all, people always put their attention on the things which are colorful or when things are moving which is human being's nature reaction.","Primary_Claim (81, 226)",3,"s1p1|Final_Claim|0,79","s1p1|Primary_Claim|443,569","Primary_Claim (81, 226)",2,"s1p1|Final_Claim|0,79",-,"Primary_Claim (81, 226)",3,"s1p1|Final_Claim|0,79","s1p1|Primary_Claim|443,569"
"(228, 441)",s1p1,"In ancient, human use the ability of noticing the moving things to search for their foods. Nowadays, advertisements use this peoples nature reactions to catch people's eye and their attention to make more profits.","Data (228, 441)",3,"s1p1|Primary_Claim|81,226",-,"Data (228, 1208)",3,"s1p1|Primary_Claim|81,226",-,"Data (228, 441)",3,"s1p1|Primary_Claim|81,226",-
"(443, 569)",s1p1,"Sometimes, human can only distinguishes the things appear in front of their eyes instead of understanding their deeper meaning.","Primary_Claim (443, 569)",3,"s1p1|Final_Claim|0,79","s1p1|Primary_Claim|81,226","Data (228, 1208)",3,"s1p1|Primary_Claim|81,226",-,"Primary_Claim (443, 569)",3,"s1p1|Final_Claim|0,79","s1p1|Primary_Claim|81,226"
"(571, 1069)",s1p1,"This is why people always got lost and they do not have time to think about what the truth are. When we reading the books, the pictures are more obvious than its content. People always believe what they see at the first sight and seldom to figure out what the reality and whole aspects of the things they see. This is also the reason why people can be tricked very easily and there are a lot of magicians and lie appearing in the world. Images and impressions does have a lot of an effect on people.","Data (571, 1069)",3,"s1p1|Primary_Claim|443,569",-,"Data (228, 1208)",3,"s1p1|Primary_Claim|81,226",-,"Data (571, 1069)",3,"s1p1|Primary_Claim|443,569",-
"(1071, 1208)",s1p1,It could bring people the delight to enjoy the beautiful things and also do harm to people by the negative affections behind those beauty.,"Concluding_Summary (1071, 1208)",3,"s1p1|Final_Claim|0,79",-,"Data (228, 1208)",3,"s1p1|Primary_Claim|81,226",-,"Concluding_Summary (1071, 1208)",3,"s1p1|Final_Claim|0,79",-
