discourse_boundary,discourse_part,discourse_text,adjudicated_discourse_type,adjudicated_effectiveness,adjudicated_hierarchical,adjudicated_parallel,jialiwang_discourse_type_boundary,jialiwang_effectiveness(f_27),jialiwang_hierarchical,jialiwang_parallel,mthomas145_discourse_type_boundary,mthomas145_effectiveness(f_27),mthomas145_hierarchical,mthomas145_parallel
"(0, 62)",s1p1,"In my opinion, images and impressions have an effect on people.","Final_Claim (0, 62)",2,-,-,"Final_Claim (0, 62)",2,-,-,"Final_Claim (0, 62)",2,-,-
"(64, 735)",s1p1,"For example, we recently saw an advertisement of Dove cosmetics where we can see a Black lady wearing a black t-shirt and while she is removing the shirt she is changing into a White girl who is also changing afterwards to Asian girl. It created a lot of heat on social medias, the advertisement was to show that the soap Dove was for Black, White or any other ethnicity but people interpreted it as being Black is being dirty when you take a shower with Dove you become clean which is being White. People were offended which lead Dove to publicly apologize. It was a video that last less than five minutes but it created a debate for almost a week all over social medias.","Data (64, 844)",3,"s1p1|Final_Claim|0,62","s1p1|Data|846,1317","Data (64, 844)",3,"s1p1|Final_Claim|0,62","s1p1|Data|846,1447","Data (64, 735)",3,"s1p1|Final_Claim|0,62","s1p1|Data|737,1317"
"(737, 844)",s1p1,"With picture, a salutation, an attitude we can either transmit on people anger, disappointment or happiness.","Data (64, 844)",3,"s1p1|Final_Claim|0,62","s1p1|Data|846,1317","Data (64, 844)",3,"s1p1|Final_Claim|0,62","s1p1|Data|846,1447","Data (737, 1317)",3,"s1p1|Final_Claim|0,62","s1p1|Data|64,735"
"(846, 1317)",s1p1,"We live in a world where communication can be made via flyer, selfie or short video, so we have to be careful of what we decide to share or to transmit to others. It can be inoffensive but still be harmful. For instance, a 22 years old girl who is originally from Africa goes on vacation to Miami and decide to post a picture in bikini on Instagram. In American culture it is just a picture with bikini on, but in African culture it shows a lack of education and maturity.","Data (846, 1317)",3,"s1p1|Final_Claim|0,62","s1p1|Data|64,844","Data (846, 1447)",3,"s1p1|Final_Claim|0,62","s1p1|Data|64,844","Data (737, 1317)",3,"s1p1|Final_Claim|0,62","s1p1|Data|64,735"
"(1319, 1447)",s1p1,"Nowadays, information goes really fast with the use of internet, it is our responsibility to transmit on other a positive effect.","Concluding_Summary (1319, 1447)",2,"s1p1|Final_Claim|0,62",-,"Data (846, 1447)",3,"s1p1|Final_Claim|0,62","s1p1|Data|64,844","Concluding_Summary (1319, 1447)",2,"s1p1|Final_Claim|0,62",-
