discourse_boundary,discourse_part,discourse_text,adjudicated_discourse_type,adjudicated_effectiveness,adjudicated_hierarchical,adjudicated_parallel,jialiwang_discourse_type_boundary,jialiwang_effectiveness(f_27),jialiwang_hierarchical,jialiwang_parallel,mthomas145_discourse_type_boundary,mthomas145_effectiveness(f_27),mthomas145_hierarchical,mthomas145_parallel
"(0, 475)",s1p1,"How many time you have heard this clause: ""Dress to impress?"" More than one time, right? As college students, who learning and working in a semi-professional environment, we are constantly reminded to dress up professional in important events in order to land a potential internship or a job offer. Have you wonder why? Psychologists have scientifically proved that human tend to develop positive attitudes toward a stranger if they are impressed by the way that person dress.","Lead (0, 475)",3,"s1p1|Final_Claim|477,559",-,"Nonannotated (0, 475)",-,-,-,"Nonannotated (0, 475)",-,-,-
"(477, 559)",s1p1,"However, in my opinion, images and impression have too much of an effect on people.","Final_Claim (477, 559)",2,-,-,"Final_Claim (477, 559)",2,-,-,"Final_Claim (477, 559)",2,-,-
"(0, 217)",s1p2,"In our society, we are taught to not judge someone based on their race, color, ethnicity or any other obvious characteristics. We should get to know the person's background, value, and skills before many any judgement.","Data (0, 700)",3,"s1p1|Final_Claim|477,559","s1p3|Data|0,505","Data (0, 700)",3,"s1p1|Final_Claim|477,559","s1p3|Data|0,505; s1p4|Data|0,202","Nonannotated (0, 217)",-,-,-
"(219, 396)",s1p2,"However, in reality, most of hiring manager make the decision whether to hire an employee solely based on their first impression on that person, mostly comes from how they dress.","Data (0, 700)",3,"s1p1|Final_Claim|477,559","s1p3|Data|0,505","Data (0, 700)",3,"s1p1|Final_Claim|477,559","s1p3|Data|0,505; s1p4|Data|0,202","Primary_Claim (219, 396)",3,"s1p1|Final_Claim|477,559","s1p3|Primary_Claim|0,106"
"(398, 700)",s1p2,"We think we can assume a stranger's life story and make prediction their work behaviors based on the first image. The fundamental attribution theory helps us understand why we make these assumptions, and still, we ignorantly have negative attitude or even discriminated action against these individuals.","Data (0, 700)",3,"s1p1|Final_Claim|477,559","s1p3|Data|0,505","Data (0, 700)",3,"s1p1|Final_Claim|477,559","s1p3|Data|0,505; s1p4|Data|0,202","Data (398, 700)",3,"s1p2|Primary_Claim|219,396",-
"(0, 106)",s1p3,Psychologist also proved that people tend to like people who are similar to them in physically or mentally.,"Data (0, 505)",2,"s1p1|Final_Claim|477,559","s1p2|Data|0,700","Data (0, 505)",1,"s1p1|Final_Claim|477,559","s1p2|Data|0,700; s1p4|Data|0,202","Primary_Claim (0, 106)",3,"s1p1|Final_Claim|477,559","s1p2|Primary_Claim|219,396"
"(108, 505)",s1p3,"Liking is one of the most important factor in persuasion technique. If someone like you, you have much higher chance to convince them to do something they originally do not intend to do. That is why companies use influential, famous people to advertise for their products. There public figures has project images that many people can relate to or dream to be, which give them the power to influent.","Data (0, 505)",2,"s1p1|Final_Claim|477,559","s1p2|Data|0,700","Data (0, 505)",1,"s1p1|Final_Claim|477,559","s1p2|Data|0,700; s1p4|Data|0,202","Data (108, 505)",3,"s1p3|Primary_Claim|0,106",-
"(0, 202)",s1p4,"Lastly, I understand why images and impression have effects on people. However, it is overused by many companies or politicians. As students, we must listen and analyze what they said, not only what the.","Concluding_Summary (0, 202)",1,"s1p1|Final_Claim|477,559",-,"Data (0, 202)",1,"s1p1|Final_Claim|477,559","s1p2|Data|0,700; s1p3|Data|0,505","Concluding_Summary (0, 202)",1,"s1p1|Final_Claim|477,559",-
