discourse_boundary,discourse_part,discourse_text,adjudicated_discourse_type,adjudicated_effectiveness,adjudicated_hierarchical,adjudicated_parallel,jialiwang_discourse_type_boundary,jialiwang_effectiveness(f_27),jialiwang_hierarchical,jialiwang_parallel,mthomas145_discourse_type_boundary,mthomas145_effectiveness(f_27),mthomas145_hierarchical,mthomas145_parallel
"(0, 216)",s1p1,"In a competition, some people, who may not know each other, fight to win against the others. Whereas cooperation embodies solidarity and friendship. Both type of working seems able to bring success for the candidates.","Lead (0, 449)",3,"s1p4|Final_Claim|0,260",-,"Nonannotated (0, 449)",-,-,-,"Final_Claim (0, 216)",3,-,-
"(218, 449)",s1p1,"However, one may be more efficient than the other. First, we will study how competition can stimulate people and bring them success. Then, we will see that cooperation is also a powerful way to achieve success, by a more modern way.","Lead (0, 449)",3,"s1p4|Final_Claim|0,260",-,"Nonannotated (0, 449)",-,-,-,"Nonannotated (218, 449)",-,-,-
"(0, 62)",s1p2,"First, competition stimulate candidates, it pushes them to win.","Primary_Claim (0, 62)",3,"s1p4|Final_Claim|0,260","s1p3|Primary_Claim|0,54","Counterclaim (0, 532)",3,"s1p4|Final_Claim|0,174",-,"Primary_Claim (0, 62)",3,"s1p1|Final_Claim|0,216","s1p3|Primary_Claim|0,54"
"(64, 532)",s1p2,"In a competition, most of the time people don't know each other. Their are just strangers that fight to win the expected prize. In sport, competition seems to be the most efficient way for people to stimulate themselves because they have nothing to loose, they trained the whole year for the competition they have waited for. Competition pushes people to do their best in order to be recognize as the best in their field, they barely want to loose in their own field...","Data (64, 532)",3,"s1p2|Primary_Claim|0,62",-,"Counterclaim (0, 532)",3,"s1p4|Final_Claim|0,174",-,"Data (64, 532)",3,"s1p2|Primary_Claim|0,62",-
"(0, 54)",s1p3,"However, another way to achieve success is cooperation.","Primary_Claim (0, 54)",3,"s1p4|Final_Claim|0,260","s1p2|Primary_Claim|0,62","Rebuttal (0, 572)",2,"s1p2|Counterclaim|0,532",-,"Primary_Claim (0, 54)",3,"s1p1|Final_Claim|0,216","s1p2|Primary_Claim|0,62"
"(56, 416)",s1p3,"Indeed, as cooperation epitomizes friendship, people know each other or are getting to know each other. They must act as responsible and adult persons because they have to work with people that may not have the same personality and views. Thus, cooperation allow groups to combine their knowledge in different fields to be more successful as if they were alone.","Data (56, 572)",3,"s1p3|Primary_Claim|0,54",-,"Rebuttal (0, 572)",2,"s1p2|Counterclaim|0,532",-,"Data (56, 416)",3,"s1p3|Primary_Claim|0,54","s1p3|Data|418,572"
"(418, 572)",s1p3,"In enterprises, cooperation seems to be more efficient than competition because people can share ideas, create with more brains and thus evolve themselves.","Data (56, 572)",3,"s1p3|Primary_Claim|0,54",-,"Rebuttal (0, 572)",2,"s1p2|Counterclaim|0,532",-,"Data (418, 572)",3,"s1p3|Primary_Claim|0,54","s1p3|Data|56,416"
"(0, 174)",s1p4,"To conclude, I think that cooperation is more efficient to achieve success in the modern world where there are more and more people and more and more knowledge in every field.","Final_Claim (0, 260)",2,-,-,"Final_Claim (0, 174)",3,-,-,"Concluding_Summary (0, 260)",2,"s1p1|Final_Claim|0,216",-
"(176, 260)",s1p4,One person cannot know everything so sharing is the only way to be really successful.,"Final_Claim (0, 260)",2,-,-,"Nonannotated (176, 260)",-,-,-,"Concluding_Summary (0, 260)",2,"s1p1|Final_Claim|0,216",-
