discourse_boundary,discourse_part,discourse_text,adjudicated_discourse_type,adjudicated_effectiveness,adjudicated_hierarchical,adjudicated_parallel,jialiwang_discourse_type_boundary,jialiwang_effectiveness(f_27),jialiwang_hierarchical,jialiwang_parallel,mthomas145_discourse_type_boundary,mthomas145_effectiveness(f_27),mthomas145_hierarchical,mthomas145_parallel
"(0, 95)",s1p1,In today's society people often tend to perceive the character of a person by their appearances.,"Final_Claim (0, 95)",2,-,-,"Final_Claim (0, 95)",3,-,-,"Final_Claim (0, 95)",2,-,-
"(97, 296)",s1p1,Appearances can be mistaken and as the old adage goes all that glitters is not gold. Our whole society is build on appearance and image. Media and advertisements takes full advantage of this scenario.,"Nonannotated (97, 296)",-,-,-,"Nonannotated (97, 296)",-,-,-,"Nonannotated (97, 296)",-,-,-
"(0, 271)",s1p2,"Companies recruit top models and actors to advertise their products. We often buy things which seems to be appealing to us. For example if an expensive cosmetic product is advertised by one of the top actors or models, people would still buy it so they can look like them.","Data (0, 470)",3,"s1p1|Final_Claim|0,95","s1p3|Data|0,369","Data (0, 470)",3,"s1p1|Final_Claim|0,95","s1p3|Data|0,369","Data (0, 271)",3,"s1p1|Final_Claim|0,95","s1p2|Data|273,469; s1p3|Data|0,369"
"(273, 470)",s1p2,"Advertisements also uses bright colors and patterns to attract viewers. People pay more attention to the way a certain commodity is packed, designed rather than paying more attention to the content.","Data (0, 470)",3,"s1p1|Final_Claim|0,95","s1p3|Data|0,369","Data (0, 470)",3,"s1p1|Final_Claim|0,95","s1p3|Data|0,369","Data (273, 469)",2,"s1p1|Final_Claim|0,95","s1p2|Data|0,271; s1p3|Data|0,369"
"(0, 369)",s1p3,"These misconceptions also exist in media where politicians, entertainers and other public figures are more important than their ability to perform. In Hollywood for instance, a person with good looks would get roles than an average looking person with the abilities. We are blinded by the outward beauty that we forget to look into another persons abilities and talents.","Data (0, 369)",3,"s1p1|Final_Claim|0,95","s1p2|Data|0,470","Data (0, 369)",3,"s1p1|Final_Claim|0,95","s1p2|Data|0,470","Data (0, 369)",3,"s1p1|Final_Claim|0,95","s1p2|Data|0,271; s1p2|Data|273,469"
